# LeetCode Problem of The Day <img src="https://github.com/user-attachments/assets/99ff7926-a1b7-47ee-a405-2fceab56a804" width="40">

This repository contains solutions to problems from ***[LeetCode](https://leetcode.com/problemset/)***. The files are named using the **problem number** for easy identification and organization.

## Key Features
- **Solutions Only**: This repository focuses on providing direct solutions without explanations.
- **File Naming**: Files are named using the problem number, e.g., `1313.java` for Problem 1313. And the **Topic** is mentioned in the **commit message**
- **Language Usage**: Solutions are primarily in **Java**, with potential use of other languages.

## Daily Progress Log - LeetCode

(to be updated as new topics are added)

| Date       | Problem Number | Solution Link                         | Problem Link                          |
|------------|----------------|---------------------------------------|---------------------------------------|
| 01-06-2025 | 2929 | [Solution](./2929.java) | [Problem](https://leetcode.com/problems/distribute-candies-among-children-ii/description/?envType=daily-question&envId=2025-06-01) |
| 31-05-2025 | 909  | [Solution](./909.java)  | [Problem](https://leetcode.com/problems/snakes-and-ladders/description/?envType=daily-question&envId=2025-05-31) |
| 30-05-2025 | 2359 | [Solution](./2359.java) | [Problem](https://leetcode.com/problems/find-closest-node-to-given-two-nodes/?envType=daily-question&envId=2025-05-30) |
| 29-05-2025 | 3373 | [Solution](./3373.java) | [Problem](https://leetcode.com/problems/maximize-the-number-of-target-nodes-after-connecting-trees-ii/description/?envType=daily-question&envId=2025-05-29) |
| 28-05-2025 | 3372 | [Solution](./3372.java) | [Problem](https://leetcode.com/problems/maximize-the-number-of-target-nodes-after-connecting-trees-i/description/?envType=daily-question&envId=2025-05-28) |
| 27-05-2025 | 2894 | [Solution](./2894.java) | [Problem](https://leetcode.com/problems/divisible-and-non-divisible-sums-difference/description/?envType=daily-question&envId=2025-05-27) |
| 26-05-2025 | 1857 | [Solution](./1857.java) | [Problem](https://leetcode.com/problems/largest-color-value-in-a-directed-graph/description/?envType=daily-question&envId=2025-05-26) |
| 25-05-2025 | 2131 | [Solution](./2131.java) | [Problem](https://leetcode.com/problems/longest-palindrome-by-concatenating-two-letter-words/description/?envType=daily-question&envId=2025-05-25) |
| 24-05-2025 | 2942 | [Solution](./2942.java) | [Problem](https://leetcode.com/problems/find-words-containing-character/description/?envType=daily-question&envId=2025-05-24) |
| 23-05-2025 | 3068 | [Solution](./3068.java) | [Problem](https://leetcode.com/problems/find-the-maximum-sum-of-node-values/?envType=daily-question&envId=2025-05-23) |
| 22-05-2025 | 3362 | [Solution](./3362.java) | [Problem](https://leetcode.com/problems/zero-array-transformation-iii/?envType=daily-question&envId=2025-05-22) |
| 21-05-2025 | 73   | [Solution](./73.java)   | [Problem](https://leetcode.com/problems/set-matrix-zeroes/description/?envType=daily-question&envId=2025-05-21) |
| 20-05-2025 | 3355 | [Solution](./3355.java) | [Problem](https://leetcode.com/problems/zero-array-transformation-i/?envType=daily-question&envId=2025-05-20) |
| 19-05-2025 | 3024 | [Solution](./3024.java) | [Problem](https://leetcode.com/problems/type-of-triangle/?envType=daily-question&envId=2025-05-19) |
| 18-05-2025 | 1931 | [Solution](./1931.java) | [Problem](https://leetcode.com/problems/painting-a-grid-with-three-different-colors/?envType=daily-question&envId=2025-05-18) |
| 17-05-2025 | 75   | [Solution](./75.java)   | [Problem](https://leetcode.com/problems/sort-colors/?envType=daily-question&envId=2025-05-17) |
| 16-05-2025 | 2901 | [Solution](./2901.java) | [Problem](https://leetcode.com/problems/longest-unequal-adjacent-groups-subsequence-ii/description/?envType=daily-question&envId=2025-05-16) |
| 15-05-2025 | 2900 | [Solution](./2900.java) | [Problem](https://leetcode.com/problems/longest-unequal-adjacent-groups-subsequence-i/description/?envType=daily-question&envId=2025-05-15) |
| 14-05-2025 | 3337 | [Solution](./3337.java) | [Problem](https://leetcode.com/problems/total-characters-in-string-after-transformations-ii/description/?envType=daily-question&envId=2025-05-14) |
| 13-05-2025 | 3335 | [Solution](./3335.java) | [Problem](https://leetcode.com/problems/total-characters-in-string-after-transformations-i/?envType=daily-question&envId=2025-05-13) |
| 12-05-2025 | 2094 | [Solution](./2094.java) | [Problem](https://leetcode.com/problems/finding-3-digit-even-numbers/description/?envType=daily-question&envId=2025-05-12) |
| 11-05-2025 | 1550 | [Solution](./1550.java) | [Problem](https://leetcode.com/problems/three-consecutive-odds/description/?envType=daily-question&envId=2025-05-11) |
| 10-05-2025 | 2918 | [Solution](./2918.java) | [Problem](https://leetcode.com/problems/minimum-equal-sum-of-two-arrays-after-replacing-zeros/?envType=daily-question&envId=2025-05-10) |
| 09-05-2025 | 3343 | [Solution](./3343.java) | [Problem](https://leetcode.com/problems/count-number-of-balanced-permutations/?envType=daily-question&envId=2025-05-09) |
| 08-05-2025 | 3342 | [Solution](./3342.java) | [Problem](https://leetcode.com/problems/find-minimum-time-to-reach-last-room-ii/?envType=daily-question&envId=2025-05-08) |
| 07-05-2025 | 3341 | [Solution](./3341.java) | [Problem](https://leetcode.com/problems/find-minimum-time-to-reach-last-room-i/?envType=daily-question&envId=2025-05-07) |
| 06-05-2025 | 1920 | [Solution](./1920.java) | [Problem](https://leetcode.com/problems/build-array-from-permutation/description/?envType=daily-question&envId=2025-05-06) |
| 05-05-2025 | 790  | [Solution](./790.java)  | [Problem](https://leetcode.com/problems/domino-and-tromino-tiling/description/?envType=daily-question&envId=2025-05-05) |
| 04-05-2025 | 1128 | [Solution](./1128.java) | [Problem](https://leetcode.com/problems/number-of-equivalent-domino-pairs/description/?envType=daily-question&envId=2025-05-04) |
| 03-05-2025 | 1007 | [Solution](./1007.java) | [Problem](https://leetcode.com/problems/minimum-domino-rotations-for-equal-row/description/?envType=daily-question&envId=2025-05-03) |
| 02-05-2025 | 838  | [Solution](./838.java)  | [Problem](https://leetcode.com/problems/push-dominoes/description/?envType=daily-question&envId=2025-05-02) |
| 01-05-2025 | 2071 | [Solution](./2071.java) | [Problem](https://leetcode.com/problems/maximum-number-of-tasks-you-can-assign/description/?envType=daily-question&envId=2025-05-01) |
| 30-04-2025 | 1295 | [Solution](./1295.java) | [Problem](https://leetcode.com/problems/find-numbers-with-even-number-of-digits/?envType=daily-question&envId=2025-04-30) |
| 29-04-2025 | 2962 | [Solution](./2962.java) | [Problem](https://leetcode.com/problems/count-subarrays-where-max-element-appears-at-least-k-times/?envType=daily-question&envId=2025-04-29) |
| 28-04-2025 | 2302 | [Solution](./2302.java) | [Problem](https://leetcode.com/problems/count-subarrays-with-score-less-than-k/description/?envType=daily-question&envId=2025-04-28) |
| 27-04-2025 | 3392 | [Solution](./3392.java) | [Problem](https://leetcode.com/problems/count-subarrays-of-length-three-with-a-condition/description/?envType=daily-question&envId=2025-04-27) |
| 26-04-2025 | 2444 | [Solution](./2444.java) | [Problem](https://leetcode.com/problems/count-subarrays-with-fixed-bounds/description/?envType=daily-question&envId=2025-04-26) |
| 25-04-2025 | 2845 | [Solution](./2845.java) | [Problem](https://leetcode.com/problems/count-of-interesting-subarrays/description/?envType=daily-question&envId=2025-04-25) |
| 24-04-2025 | 2799 | [Solution](./2799.java) | [Problem](https://leetcode.com/problems/count-complete-subarrays-in-an-array/description/?envType=daily-question&envId=2025-04-24) |
| 23-04-2025 | 1399 | [Solution](./1399.java) | [Problem](https://leetcode.com/problems/count-largest-group/?envType=daily-question&envId=2025-04-23) |
| 22-04-2025 | 2338 | [Solution](./2338.java) | [Problem](https://leetcode.com/problems/count-the-number-of-ideal-arrays/?envType=daily-question&envId=2025-04-22) |
| 21-04-2025 | 2145 | [Solution](./2145.java) | [Problem](https://leetcode.com/problems/count-the-hidden-sequences/description/?envType=daily-question&envId=2025-04-21) |
| 20-04-2025 | 781  | [Solution](./781.java)  | [Problem](https://leetcode.com/problems/rabbits-in-forest/description/?envType=daily-question&envId=2025-04-20) |
| 19-04-2025 | 2563 | [Solution](./2563.java) | [Problem](https://leetcode.com/problems/count-the-number-of-fair-pairs/?envType=daily-question&envId=2025-04-19) |
| 18-04-2025 | 38   | [Solution](./38.java)   | [Problem](https://leetcode.com/problems/count-and-say/description/?envType=daily-question&envId=2025-04-18) |
| 17-04-2025 | 2176 | [Solution](./2176.java) | [Problem](https://leetcode.com/problems/count-equal-and-divisible-pairs-in-an-array/description/?envType=daily-question&envId=2025-04-17) |
| 16-04-2025 | 2537 | [Solution](./2537.java) | [Problem](https://leetcode.com/problems/count-the-number-of-good-subarrays/description/?envType=daily-question&envId=2025-04-16) |
| 15-04-2025 | 2179 | [Solution](./2179.java) | [Problem](https://leetcode.com/problems/count-good-triplets-in-an-array/description/?envType=daily-question&envId=2025-04-15) |
| 14-04-2025 | 1534 | [Solution](./1534.java) | [Problem](https://leetcode.com/problems/count-good-triplets/description/?envType=daily-question&envId=2025-04-14) |
| 13-04-2025 | 1922 | [Solution](./1922.java) | [Problem](https://leetcode.com/problems/count-good-numbers/description/?envType=daily-question&envId=2025-04-13) |
| 12-04-2025 | 3272 | [Solution](./3272.java) | [Problem](https://leetcode.com/problems/find-the-count-of-good-integers/description/?envType=daily-question&envId=2025-04-12) |
| 11-04-2025 | 2843 | [Solution](./2843.java) | [Problem](https://leetcode.com/problems/count-symmetric-integers/description/?envType=daily-question&envId=2025-04-11) |
| 10-04-2025 | 2999 | [Solution](./2999.java) | [Problem](https://leetcode.com/problems/count-the-number-of-powerful-integers/description/?envType=daily-question&envId=2025-04-10) |
| 09-04-2025 | 3375 | [Solution](./3375.java) | [Problem](https://leetcode.com/problems/minimum-operations-to-make-array-values-equal-to-k/description/?envType=daily-question&envId=2025-04-09) |
| 08-04-2025 | 3396 | [Solution](./3396.java) | [Problem](https://leetcode.com/problems/minimum-number-of-operations-to-make-elements-in-array-distinct/description/?envType=daily-question&envId=2025-04-08) |
| 07-04-2025 | 416  | [Solution](./416.java)  | [Problem](https://leetcode.com/problems/partition-equal-subset-sum/?envType=daily-question&envId=2025-04-07) |
| 06-04-2025 | 368  | [Solution](./368.java)  | [Problem](https://leetcode.com/problems/largest-divisible-subset/description/?envType=daily-question&envId=2025-04-06) |
| 05-04-2025 | 1863 | [Solution](./1863.java) | [Problem](https://leetcode.com/problems/sum-of-all-subset-xor-totals/description/?envType=daily-question&envId=2025-04-05) |
| 04-04-2025 | 1123 | [Solution](./1123.java) | [Problem](https://leetcode.com/problems/lowest-common-ancestor-of-deepest-leaves/description/?envType=daily-question&envId=2025-04-04) |
| 03-04-2025 | 2874 | [Solution](./2874.java) | [Problem](https://leetcode.com/problems/maximum-value-of-an-ordered-triplet-ii/description/?envType=daily-question&envId=2025-04-03) |
| 02-04-2025 | 2873 | [Solution](./2873.java) | [Problem](https://leetcode.com/problems/maximum-value-of-an-ordered-triplet-i/description/?envType=daily-question&envId=2025-04-02) |
| 01-04-2025 | 2140 | [Solution](./2140.java) | [Problem](https://leetcode.com/problems/solving-questions-with-brainpower/description/?envType=daily-question&envId=2025-04-01) |
| 31-03-2025 | 2551 | [Solution](./2551.java) | [Problem](https://leetcode.com/problems/put-marbles-in-bags/description/?envType=daily-question&envId=2025-03-31) |
| 30-03-2025 | 763  | [Solution](./763.java)  | [Problem](https://leetcode.com/problems/partition-labels/description/?envType=daily-question&envId=2025-03-30) |
| 29-03-2025 | 2818 | [Solution](./2818.java) | [Problem](https://leetcode.com/problems/apply-operations-to-maximize-score/description/?envType=daily-question&envId=2025-03-29) |
| 28-03-2025 | 2503 | [Solution](./2503.java) | [Problem](https://leetcode.com/problems/maximum-number-of-points-from-grid-queries/description/?envType=daily-question&envId=2025-03-28) |
| 27-03-2025 | 2780 | [Solution](./2780.java) | [Problem](https://leetcode.com/problems/minimum-index-of-a-valid-split/description/?envType=daily-question&envId=2025-03-27) |
| 26-03-2025 | 2033 | [Solution](./2033.java) | [Problem](https://leetcode.com/problems/minimum-operations-to-make-a-uni-value-grid/description/?envType=daily-question&envId=2025-03-26) |
| 25-03-2025 | 3394 | [Solution](./3394.java) | [Problem](https://leetcode.com/problems/check-if-grid-can-be-cut-into-sections/description/?envType=daily-question&envId=2025-03-25) |
| 24-03-2025 | 3169 | [Solution](./3169.java) | [Problem](https://leetcode.com/problems/count-days-without-meetings/description/?envType=daily-question&envId=2025-03-24) |
| 23-03-2025 | 1976 | [Solution](./1976.java) | [Problem](https://leetcode.com/problems/number-of-ways-to-arrive-at-destination/description/?envType=daily-question&envId=2025-03-23) |
| 22-03-2025 | 2685 | [Solution](./2685.java) | [Problem](https://leetcode.com/problems/count-the-number-of-complete-components/description/?envType=daily-question&envId=2025-03-22) |
| 21-03-2025 | 2115 | [Solution](./2115.java) | [Problem](https://leetcode.com/problems/find-all-possible-recipes-from-given-supplies/description/?envType=daily-question&envId=2025-03-21) |
| 20-03-2025 | 3108 | [Solution](./3108.java) | [Problem](https://leetcode.com/problems/minimum-cost-walk-in-weighted-graph/description/?envType=daily-question&envId=2025-03-20) |
| 19-03-2025 | 3191 | [Solution](./3191.java) | [Problem](https://leetcode.com/problems/minimum-operations-to-make-binary-array-elements-equal-to-one-i/description/?envType=daily-question&envId=2025-03-19) |
| 18-03-2025 | 2401 | [Solution](./2401.java) | [Problem](https://leetcode.com/problems/longest-nice-subarray/description/?envType=daily-question&envId=2025-03-18) |
| 17-03-2025 | 2206 | [Solution](./2206.java) | [Problem](https://leetcode.com/problems/divide-array-into-equal-pairs/?envType=daily-question&envId=2025-03-17) |
| 16-03-2025 | 2594 | [Solution](./2594.java) | [Problem](https://leetcode.com/problems/minimum-time-to-repair-cars/description/?envType=daily-question&envId=2025-03-16) |
| 15-03-2025 | 2560 | [Solution](./2560.java) | [Problem](https://leetcode.com/problems/house-robber-iv/description/?envType=daily-question&envId=2025-03-15) |
| 14-03-2025 | 2226 | [Solution](./2226.java) | [Problem](https://leetcode.com/problems/maximum-candies-allocated-to-k-children/?envType=daily-question&envId=2025-03-14) |
| 13-03-2025 | 3356 | [Solution](./3356.java) | [Problem](https://leetcode.com/problems/zero-array-transformation-ii/?envType=daily-question&envId=2025-03-13) |
| 12-03-2025 | 2529 | [Solution](./2529.java) | [Problem](https://leetcode.com/problems/maximum-count-of-positive-integer-and-negative-integer/description/?envType=daily-question&envId=2025-03-12) |
| 11-03-2025 | 1358 | [Solution](./1358.java) | [Problem](https://leetcode.com/problems/number-of-substrings-containing-all-three-characters/description/?envType=daily-question&envId=2025-03-11) |
| 10-03-2025 | 3306 | [Solution](./3306.java) | [Problem](https://leetcode.com/problems/count-of-substrings-containing-every-vowel-and-k-consonants-ii/description/?envType=daily-question&envId=2025-03-10) |
| 09-03-2025 | 3208 | [Solution](./3208.java) | [Problem](https://leetcode.com/problems/alternating-groups-ii/description/?envType=daily-question&envId=2025-03-09) |
| 08-03-2025 | 2379 | [Solution](./2379.java) | [Problem](https://leetcode.com/problems/minimum-recolors-to-get-k-consecutive-black-blocks/description/?envType=daily-question&envId=2025-03-08) |
| 07-03-2025 | 2523 | [Solution](./2523.java) | [Problem](https://leetcode.com/problems/closest-prime-numbers-in-range/description/?envType=daily-question&envId=2025-03-07) |
| 06-03-2025 | 2965 | [Solution](./2965.java) | [Problem](https://leetcode.com/problems/find-missing-and-repeated-values/description/?envType=daily-question&envId=2025-03-06) |
| 05-03-2025 | 2579 | [Solution](./2579.java) | [Problem](https://leetcode.com/problems/count-total-number-of-colored-cells/?envType=daily-question&envId=2025-03-05) |
| 04-03-2025 | 1780 | [Solution](./1780.java) | [Problem](https://leetcode.com/problems/check-if-number-is-a-sum-of-powers-of-three/description/?envType=daily-question&envId=2025-03-04) |
| 03-03-2025 | 2161 | [Solution](./2161.java) | [Problem](https://leetcode.com/problems/partition-array-according-to-given-pivot/description/?envType=daily-question&envId=2025-03-03) |
| 02-03-2025 | 2570 | [Solution](./2570.java) | [Problem](https://leetcode.com/problems/merge-two-2d-arrays-by-summing-values/description/?envType=daily-question&envId=2025-03-02) |
| 01-03-2025 | 2460 | [Solution](./2460.java) | [Problem](https://leetcode.com/problems/apply-operations-to-an-array/description/?envType=daily-question&envId=2025-03-01) |
| 28-02-2025 | 1092 | [Solution](./1092.java) | [Problem](https://leetcode.com/problems/shortest-common-supersequence/description/?envType=daily-question&envId=2025-02-28) |
| 27-02-2025 | 873  | [Solution](./873.java)  | [Problem](https://leetcode.com/problems/length-of-longest-fibonacci-subsequence/description/?envType=daily-question&envId=2025-02-27) |
| 26-02-2025 | 1749 | [Solution](./1749.java) | [Problem](https://leetcode.com/problems/maximum-absolute-sum-of-any-subarray/description/?envType=daily-question&envId=2025-02-26) |
| 25-02-2025 | 1524 | [Solution](./1524.java) | [Problem](https://leetcode.com/problems/number-of-sub-arrays-with-odd-sum/?envType=daily-question&envId=2025-02-25) |
| 24-02-2025 | 2467 | [Solution](./2467.java) | [Problem](https://leetcode.com/problems/most-profitable-path-in-a-tree/description/?envType=daily-question&envId=2025-02-24) |
| 23-02-2025 | 889  | [Solution](./889.java)  | [Problem](https://leetcode.com/problems/construct-binary-tree-from-preorder-and-postorder-traversal/description/?envType=daily-question&envId=2025-02-23) |
| 22-02-2025 | 1028 | [Solution](./1028.java) | [Problem](https://leetcode.com/problems/recover-a-tree-from-preorder-traversal/description/?envType=daily-question&envId=2025-02-22) |
| 21-02-2025 | 1261 | [Solution](./1261.java) | [Problem](https://leetcode.com/problems/find-elements-in-a-contaminated-binary-tree/description/?envType=daily-question&envId=2025-02-21) |
| 20-02-2025 | 1980 | [Solution](./1980.java) | [Problem](https://leetcode.com/problems/find-unique-binary-string/description/?envType=daily-question&envId=2025-02-20) |
| 19-02-2025 | 1415 | [Solution](./1415.java) | [Problem](https://leetcode.com/problems/the-k-th-lexicographical-string-of-all-happy-strings-of-length-n/description/?envType=daily-question&envId=2025-02-19) |
| 18-02-2025 | 2375 | [Solution](./2375.java) | [Problem](https://leetcode.com/problems/construct-smallest-number-from-di-string/description/?envType=daily-question&envId=2025-02-18) |
| 17-02-2025 | 1079 | [Solution](./1079.java) | [Problem](https://leetcode.com/problems/letter-tile-possibilities/description/?envType=daily-question&envId=2025-02-17) |
| 16-02-2025 | 1718 | [Solution](./1718.java) | [Problem](https://leetcode.com/problems/construct-the-lexicographically-largest-valid-sequence/description/?envType=daily-question&envId=2025-02-16) |
| 15-02-2025 | 2698 | [Solution](./2698.java) | [Problem](https://leetcode.com/problems/find-the-punishment-number-of-an-integer/description/?envType=daily-question&envId=2025-02-15) |
| 14-02-2025 | 1352 | [Solution](./1352.java) | [Problem](https://leetcode.com/problems/product-of-the-last-k-numbers/description/?envType=daily-question&envId=2025-02-14) |
| 13-02-2025 | 3066 | [Solution](./3066.java) | [Problem](https://leetcode.com/problems/minimum-operations-to-exceed-threshold-value-ii/description/?envType=daily-question&envId=2025-02-13) |
| 12-02-2025 | 2342 | [Solution](./2342.java) | [Problem](https://leetcode.com/problems/max-sum-of-a-pair-with-equal-sum-of-digits/description/?envType=daily-question&envId=2025-02-12) |
| 11-02-2025 | 1910 | [Solution](./1910.java) | [Problem](https://leetcode.com/problems/remove-all-occurrences-of-a-substring/description/?envType=daily-question&envId=2025-02-11) |
| 10-02-2025 | 3174 | [Solution](./3174.java) | [Problem](https://leetcode.com/problems/clear-digits/description/?envType=daily-question&envId=2025-02-10) |
| 09-02-2025 | 2364 | [Solution](./2364.java) | [Problem](https://leetcode.com/problems/count-number-of-bad-pairs/description/?envType=daily-question&envId=2025-02-09) |
| 08-02-2025 | 2349 | [Solution](./2349.java) | [Problem](https://leetcode.com/problems/design-a-number-container-system/description/?envType=daily-question&envId=2025-02-08) |
| 07-02-2025 | 3160 | [Solution](./3160.java) | [Problem](https://leetcode.com/problems/find-the-number-of-distinct-colors-among-the-balls/description/?envType=daily-question&envId=2025-02-07) |
| 06-02-2025 | 1726 | [Solution](./1726.java) | [Problem](https://leetcode.com/problems/tuple-with-same-product/description/?envType=daily-question&envId=2025-02-06) |
| 05-02-2025 | 1790 | [Solution](./1790.java) | [Problem](https://leetcode.com/problems/check-if-one-string-swap-can-make-strings-equal/description/?envType=daily-question&envId=2025-02-05) |
| 04-02-2025 | 1800 | [Solution](./1800.java) | [Problem](https://leetcode.com/problems/maximum-ascending-subarray-sum/description/?envType=daily-question&envId=2025-02-04) |
| 03-02-2025 | 3105 | [Solution](./3105.java) | [Problem](https://leetcode.com/problems/longest-strictly-increasing-or-strictly-decreasing-subarray/description/?envType=daily-question&envId=2025-02-03) |
| 02-02-2025 | 1752 | [Solution](./1752.java) | [Problem](https://leetcode.com/problems/check-if-array-is-sorted-and-rotated/description/?envType=daily-question&envId=2025-02-02) |
| 01-02-2025 | 3151 | [Solution](./3151.java) | [Problem](https://leetcode.com/problems/special-array-i/description/?envType=daily-question&envId=2025-02-01) |
| 31-01-2025 | 827  | [Solution](./827.java)  | [Problem](https://leetcode.com/problems/making-a-large-island/description/?envType=daily-question&envId=2025-01-31) |
| 30-01-2025 | 2493 | [Solution](./2493.java) | [Problem](https://leetcode.com/problems/divide-nodes-into-the-maximum-number-of-groups/description/?envType=daily-question&envId=2025-01-30) |
| 29-01-2025 | 684  | [Solution](./684.java)  | [Problem](https://leetcode.com/problems/redundant-connection/description/?envType=daily-question&envId=2025-01-29) |
| 28-01-2025 | 2658 | [Solution](./2658.java) | [Problem](https://leetcode.com/problems/maximum-number-of-fish-in-a-grid/?envType=daily-question&envId=2025-01-28) |
| 27-01-2025 | 1462 | [Solution](./1462.java) | [Problem](https://leetcode.com/problems/course-schedule-iv/description/?envType=daily-question&envId=2025-01-27) |
| 26-01-2025 | 2127 | [Solution](./2127.java) | [Problem](https://leetcode.com/problems/maximum-employees-to-be-invited-to-a-meeting/description/?envType=daily-question&envId=2025-01-26) |
| 25-01-2025 | 2948 | [Solution](./2948.java) | [Problem](https://leetcode.com/problems/make-lexicographically-smallest-array-by-swapping-elements/description/?envType=daily-question&envId=2025-01-25) |
| 24-01-2025 | 802  | [Solution](./802.java)  | [problem](https://leetcode.com/problems/find-eventual-safe-states/description/?envType=daily-question&envId=2025-01-24) |
| 23-01-2025 | 1267 | [Solution](./1267.java) | [problem](https://leetcode.com/problems/count-servers-that-communicate/description/?envType=daily-question&envId=2025-01-23) |
| 22-01-2025 | 1765 | [Solution](./1765.java) | [problem](https://leetcode.com/problems/map-of-highest-peak/?envType=daily-question&envId=2025-01-22) |
| 21-01-2025 | 2017 | [Solution](./2017.java) | [problem](https://leetcode.com/problems/grid-game/description/?envType=daily-question&envId=2025-01-21) |
| 20-01-2025 | 2661 | [Solution](./2661.java) | [problem](https://leetcode.com/problems/first-completely-painted-row-or-column/description/?envType=daily-question&envId=2025-01-20) |
| 19-01-2025 | 407  | [Solution](./407.java)  | [problem](https://leetcode.com/problems/trapping-rain-water-ii/description/?envType=daily-question&envId=2025-01-19) |
| 18-01-2025 | 1368 | [Solution](./1368.java) | [problem](https://leetcode.com/problems/minimum-cost-to-make-at-least-one-valid-path-in-a-grid/description/?envType=daily-question&envId=2025-01-18) |
| 17-01-2025 | 2683 | [Solution](./2683.java) | [problem](https://leetcode.com/problems/neighboring-bitwise-xor/description/?envType=daily-question&envId=2025-01-17) |
| 16-01-2025 | 2425 | [Solution](./2425.java) | [problem](https://leetcode.com/problems/bitwise-xor-of-all-pairings/description/?envType=daily-question&envId=2025-01-16) |
| 15-01-2025 | 2429 | [Solution](./2429.java) | [problem](https://leetcode.com/problems/minimize-xor/description/?envType=daily-question&envId=2025-01-15) |
| 14-01-2025 | 2657 | [Solution](./2657.java) | [problem](https://leetcode.com/problems/find-the-prefix-common-array-of-two-arrays/description/?envType=daily-question&envId=2025-01-14) |
| 13-01-2025 | 3223 | [Solution](./3223.java) | [problem](https://leetcode.com/problems/minimum-length-of-string-after-operations/description/?envType=daily-question&envId=2025-01-13) |
| 12-01-2025 | 2116 | [Solution](./2116.java) | [problem](https://leetcode.com/problems/check-if-a-parentheses-string-can-be-valid/description/?envType=daily-question&envId=2025-01-12) |
| 11-01-2025 | 1400 | [Solution](./1400.java) | [problem](https://leetcode.com/problems/construct-k-palindrome-strings/description/?envType=daily-question&envId=2025-01-11) |
| 10-01-2025 | 916  | [Solution](./916.java)  | [problem](https://leetcode.com/problems/word-subsets/description/?envType=daily-question&envId=2025-01-10) |
| 09-01-2025 | 2185 | [Solution](./2185.java) | [problem](https://leetcode.com/problems/counting-words-with-a-given-prefix/description/?envType=daily-question&envId=2025-01-09) |
| 08-01-2025 | 3042 | [Solution](./3042.java) | [problem](https://leetcode.com/problems/count-prefix-and-suffix-pairs-i/description/?envType=daily-question&envId=2025-01-08) |
| 07-01-2025 | 1408 | [Solution](./1408.java) | [problem](https://leetcode.com/problems/string-matching-in-an-array/description/?envType=daily-question&envId=2025-01-07) |
| 06-01-2025 | 1769 | [Solution](./1769.java) | [problem](https://leetcode.com/problems/minimum-number-of-operations-to-move-all-balls-to-each-box/description/?envType=daily-question&envId=2025-01-06) |
| 05-01-2025 | 2381 | [Solution](./2381.java) | [problem](https://leetcode.com/problems/shifting-letters-ii/description/?envType=daily-question&envId=2025-01-05) |
| 04-01-2025 | 1930 | [Solution](./1930.java) | [problem](https://leetcode.com/problems/unique-length-3-palindromic-subsequences/description/?envType=daily-question&envId=2025-01-04) |
| 03-01-2025 | 2270 | [Solution](./2270.java) | [problem](https://leetcode.com/problems/number-of-ways-to-split-array/description/?envType=daily-question&envId=2025-01-03) |
| 02-01-2025 | 2559 | [Solution](./2559.java) | [problem](https://leetcode.com/problems/count-vowel-strings-in-ranges/description/?envType=daily-question&envId=2025-01-02) |
| 01-01-2025 | 1422 | [Solution](./1422.java) | [problem](https://leetcode.com/problems/maximum-score-after-splitting-a-string/description/?envType=daily-question&envId=2025-01-01) |

## 🌟 *Don’t Forget to Star!*
If you find this repo useful, please consider giving it a star ⭐. It helps others discover it too!
